{
 "category": "interiors-dwellings-trades",
 "version": 1,
 "author": "research agent PA2",
 "date": "2026-09-29",
 "stage": "D",
 "scope_note": "Interiors of the KEEP shells (dwellings, trade shells and townhouse shop sets; civic shells counted where they share rooms): room-by-tier contents, interior materials, built-in fittings (jp_p_fit_*, merged into shells like kit parts) and the interior core props (jp_f_*, proxies). Trade-specific props (brewery, smithy, kilns, looms) are built with their shells (PRODUCTION_PLAN). Loot tiers ignored. Extra keys per entry: structural (fittings), loot_surface, abandoned_state, wave, pilot, blocks_path, reach.",
 "entries": [
  {
   "id": "jp_p_fit_floor",
   "name": "Room floor recipes: tatami room, board floor, bamboo-slat floor, doma (promoted from the machiya build)",
   "what": "The floor of every room by its tag and tier: tatami (T2 best room, T3 living rooms), boards (daidokoro, storage, T1 living), split bamboo (poorest huts), earth doma. The machiya code already has tatami_room / board_floor / doma_floor; they move into the kit and get the real materials.",
   "importance": "standard",
   "tiers": [
    1,
    2,
    3
   ],
   "priority": "P1",
   "room_tags": [
    "doma",
    "daidokoro",
    "living",
    "zashiki",
    "sleeping",
    "shop",
    "office",
    "workshop",
    "storage",
    "stable",
    "engawa",
    "corridor",
    "guard",
    "toilet"
   ],
   "period_evidence": "Tatami reach townspeople by the end of the 17th c. [T01], widespread among commoners mid-Edo, rural later [N01]; no tatami in T1 [T58, PLAYBOOK §2.1]; tataki doma general in the Edo period [N16]; surviving floors [i01, i03, i24]",
   "refs": [
    {
     "id": "c21_tatami",
     "shows": "tatami facing weave and heri edge",
     "period_image": false
    },
    {
     "id": "i03_tenmyo_irori",
     "shows": "board room beside a tatami room (farmhouse)",
     "period_image": true
    },
    {
     "id": "i01_kasuya_irori",
     "shows": "dark polished board floor",
     "period_image": true
    },
    {
     "id": "i06_tsunashima_doma",
     "shows": "earth doma (colour sample)",
     "period_image": true
    },
    {
     "id": "i02_kasuya_kamado",
     "shows": "earth doma, sunlit (colour sample)",
     "period_image": true
    }
   ],
   "dimensions": {
    "tatami_m": {
     "value": "fills the room between post faces: about 1.78 x 0.87 on the 1.82 grid (Inakama); 0.055 thick; heri 0.03",
     "source": "PLAYBOOK §3-4 [T01, N01]; machiya build"
    },
    "layout": {
     "value": "shugi (no four corners meet); half mat in the centre of 4.5-mat rooms",
     "source": "PLAYBOOK §3 (convention)"
    },
    "boards_m": {
     "value": "0.20-0.30 wide, 0.03 thick top boards on a 0.15 base",
     "source": "machiya build"
    },
    "levels_m": {
     "value": "doma = grade + 0.05; raised floors +0.45 over the doma; storage boards +0.03",
     "source": "PLAYBOOK §4; machiya build"
    }
   },
   "materials": [
    {
     "surface": "tatami facing",
     "material": "jp_m_floor_tatami",
     "palette_id": "tatami_aged"
    },
    {
     "surface": "heri",
     "material": "jp_m_floor_tatami_heri",
     "palette_id": "tatami_heri"
    },
    {
     "surface": "boards",
     "material": "jp_m_floor_boards_int",
     "palette_id": "timber_interior"
    },
    {
     "surface": "rough boards (T1, stable, shed)",
     "material": "jp_m_floor_boards_rough",
     "palette_id": "timber_interior"
    },
    {
     "surface": "bamboo slats (T1)",
     "material": "jp_m_floor_takeyuka",
     "palette_id": "bamboo_weathered"
    },
    {
     "surface": "doma T1 / farm",
     "material": "jp_m_ground_doma_earth",
     "palette_id": "doma_earth"
    },
    {
     "surface": "doma T2-3 (tataki)",
     "material": "jp_m_ground_doma_tataki",
     "palette_id": "doma_earth"
    },
    {
     "surface": "under-floor",
     "material": "jp_m_wood_sooted",
     "palette_id": "timber_sooted"
    }
   ],
   "connectors": [
    "floor: one recipe per room rect from rooms.json (tag, floor, level)",
    "roadway: textile_carpet_int (tatami), wood_planks_int (boards), dirt_int (doma) (PLAYBOOK §9)"
   ],
   "variants": [
    {
     "id": "_tatami",
     "differs_by": "tatami room (shugi solver)",
     "tier": 2
    },
    {
     "id": "_boards",
     "differs_by": "board floor"
    },
    {
     "id": "_rough",
     "differs_by": "rough adzed boards",
     "tier": 1
    },
    {
     "id": "_takeyuka",
     "differs_by": "bamboo slats under mats",
     "tier": 1
    },
    {
     "id": "_doma",
     "differs_by": "earth / tataki"
    },
    {
     "id": "_tatami_lifted",
     "differs_by": "one or two mats lifted or missing, base boards showing (abandoned; a 0.055 step)",
     "tier": 3
    }
   ],
   "structural": "NONE (recipes over the room rect); the machiya needs a rebuild to swap its stand-in materials",
   "loot_surface": "the floor itself: lootFloor points on the Roadway minus prop footprints + 0.4 m",
   "abandoned_state": "_w2 mats in one room in three, dust lanes, a lifted mat; doma with leaf litter at the doors",
   "deviations": [
    "D10: tatami are a floor mesh with a mat layout, loot on the floor"
   ],
   "lod_budget": "part of the building budget (machiya: mats modelled per mat in LOD0, one slab in LOD2-3)",
   "checks": [
    "C1",
    "C2",
    "C4",
    "C5",
    "C6",
    "C8",
    "C9"
   ],
   "region": "all",
   "status_overlay": "commoner",
   "reach": {
    "shells": 45,
    "rooms": 172,
    "shell_ids": [
     "D1",
     "D30",
     "D2",
     "D3",
     "D4",
     "D5",
     "D6",
     "D7",
     "D8",
     "D9",
     "D10",
     "D11",
     "D12",
     "D13",
     "D14",
     "D15",
     "D16",
     "D17",
     "D18",
     "D19",
     "D20",
     "D21",
     "D22",
     "D23",
     "D24",
     "D25",
     "D26",
     "D29",
     "T1",
     "T5",
     "T6",
     "T7",
     "T8",
     "T9",
     "T11",
     "T12",
     "T13",
     "T14",
     "T3",
     "T4",
     "T23",
     "C1",
     "C2",
     "C3",
     "C4"
    ],
    "shop_sets": 22
   },
   "stage": "B"
  },
  {
   "id": "jp_p_fit_irori",
   "name": "Sunken hearth (irori) with frame (robuchi), ash bed and hook beam",
   "what": "The square hearth cut into the board floor of the daidokoro / hiroma: wooden frame, ash bed, and a beam or hook point overhead for the jizai-kagi.",
   "importance": "standard",
   "tiers": [
    1,
    2,
    3
   ],
   "priority": "P1",
   "room_tags": [
    "daidokoro",
    "living",
    "guard"
   ],
   "period_evidence": "Kitamura house 1687 hiroma with irori [BL §3, E01]; irori with jizai-kagi and fish-shaped yokogi, hidana rack [N12]; surviving farmhouse hearths [i01, i03, i04, i10]",
   "refs": [
    {
     "id": "i03_tenmyo_irori",
     "shows": "irori in a board room, jizai-kagi from the beam, tatami room behind (Edo-Tokyo museum farmhouse)",
     "period_image": true
    },
    {
     "id": "i04_tsunashima_irori",
     "shows": "ash bed, wood frame, kettle on the hook, firewood (Tsunashima farmhouse)",
     "period_image": true
    },
    {
     "id": "i01_kasuya_irori",
     "shows": "irori flush in a dark polished board floor, kettle on a hook (Kasuya house, Itabashi)",
     "period_image": true
    },
    {
     "id": "i10_hearth_boards",
     "shows": "frame and ash bed in a board floor",
     "period_image": false
    },
    {
     "id": "i33_morse_jizai",
     "shows": "Morse 1885: simple peasant ji-zai",
     "period_image": false
    }
   ],
   "dimensions": {
    "pit_m": {
     "value": "0.91 x 0.91 (half-ken square, small houses) or 0.91 x 1.365 / 1.82 (farmhouses, headman)",
     "assumed": true,
     "reason": "common museum sizes; snaps to the half-ken grid (rule 9); no period source read"
    },
    "frame_m": {
     "value": "robuchi 0.09 wide x 0.09 deep, top flush with the floor",
     "assumed": true,
     "reason": "typical; hardwood"
    },
    "ash_bed_m": {
     "value": "0.12 below the floor (walkable step, Roadway on the ash)",
     "assumed": true,
     "reason": "reason: a player who steps in must not fall or stick"
    },
    "hook_point_m": {
     "value": "beam or hook batten 2.30-2.60 above the floor, over the pit centre",
     "assumed": true,
     "reason": "reason: carries jp_f_jizai_kagi; clears D2 head room at the pit edge"
    }
   },
   "materials": [
    {
     "surface": "frame",
     "material": "jp_m_wood_interior",
     "palette_id": "timber_interior"
    },
    {
     "surface": "ash bed",
     "material": "jp_m_ground_ash",
     "palette_id": "ash_grey"
    },
    {
     "surface": "hook beam, soot above",
     "material": "jp_m_wood_sooted",
     "palette_id": "timber_sooted"
    }
   ],
   "connectors": [
    "floor: cut into a raised board floor (not tatami); the floor recipe leaves the opening and a Roadway at -0.12",
    "post: centred between grid lines; the hook beam spans post to post"
   ],
   "variants": [
    {
     "id": "_s",
     "differs_by": "0.91 square (huts, tenement-size rooms, guard huts)",
     "tier": 1
    },
    {
     "id": "_l",
     "differs_by": "0.91 x 1.365 (farmhouse hiroma)",
     "tier": 2
    },
    {
     "id": "_hidana",
     "differs_by": "adds a slatted smoke/drying rack (hidana) hung above, sooted",
     "tier": 1
    }
   ],
   "structural": "FLOOR OPENING in the raised board floor + a hook beam overhead (and a smoke outlet in the roof: exterior jp_p_roof_kemuridashi)",
   "loot_surface": "none on the frame; the ash bed is a floor point (range <=0.3)",
   "abandoned_state": "cold grey ash, a few charred sticks, the pot hook empty or with a rusted pot; soot on everything above",
   "deviations": [
    "Ash bed walkable at -0.12 (reason)"
   ],
   "lod_budget": "part of the building budget: <=200 faces",
   "banned_tells_to_watch": [
    "brick or cut-stone hearth (modern)",
    "a chimney"
   ],
   "checks": [
    "C1",
    "C2",
    "C4",
    "C5",
    "C6",
    "C8",
    "C9"
   ],